[
  {
    "date": "2026-06",
    "title": "Отчёт за июнь 2026",
    "summary": "Первый месяц сбора. Запущены каналы приёма средств.",
    "collected_rub": 0,
    "donor_count": 0,
    "spending": [
      { "item": "Работа над комментариями к Книге V", "amount_rub": 0 }
    ],
    "note": "Отчёт будет дополнен после поступления первых средств."
  }
]
